{
  "protocol_version": "v1",
  "receipt_id": "55555555-5555-4555-8555-555555555555",
  "receipt_type": "recipient_processed",
  "message_id": "11111111-1111-4111-8111-111111111111",
  "envelope_sha256": "830f90faf787eed830d4f5e6445d12ef208a4ab4d61cf59107baa7186743b68f",
  "stream_id": "22222222-2222-4222-8222-222222222222",
  "message_sequence": 1,
  "sender_principal": "phone:pixel",
  "recipient_principal": "host:vera",
  "issued_at": "2026-09-13T18:00:03Z",
  "signer_binding": "recipient",
  "signer": {
    "role": "vera-host",
    "principal": "host:vera",
    "key_id": "1f3398e6e278f68a15b7fe32236933b8b2f86a6cb02415c57ecc7e1b9b0f16c3",
    "key_epoch": 1
  },
  "transition": {
    "from": "recipient_stored",
    "to": "recipient_processed"
  },
  "signature": {
    "algorithm": "ecdsa-p256-sha256",
    "encoding": "p1363",
    "key_id": "1f3398e6e278f68a15b7fe32236933b8b2f86a6cb02415c57ecc7e1b9b0f16c3",
    "signature_base64": "R1hwGaw0sV7cARJNYMHabePYaXJg8+/SijS0PDG/3NPuLuj0wTPOegMSGYVKhIE8AVyTF8QVWrIocklM4Annsg=="
  }
}
