{
  "protocol_version": "v1",
  "receipt_id": "33333333-3333-4333-8333-333333333333",
  "receipt_type": "relay_custody",
  "message_id": "11111111-1111-4111-8111-111111111111",
  "envelope_sha256": "830f90faf787eed830d4f5e6445d12ef208a4ab4d61cf59107baa7186743b68f",
  "stream_id": "22222222-2222-4222-8222-222222222222",
  "message_sequence": 1,
  "sender_principal": "phone:pixel",
  "recipient_principal": "host:vera",
  "issued_at": "2026-09-13T18:00:01Z",
  "relay_installation_id": "relay-ds216",
  "signer_binding": "relay_custody",
  "signer": {
    "role": "relay-custody",
    "principal": "relay:relay-ds216",
    "key_id": "50b1b0ca61ee2b9b2a48fc24f2ecf779a7f3f345e02df9807ed6d4820c59caee",
    "key_epoch": 1
  },
  "transition": {
    "from": "none",
    "to": "relay_accepted"
  },
  "signature": {
    "algorithm": "ecdsa-p256-sha256",
    "encoding": "p1363",
    "key_id": "50b1b0ca61ee2b9b2a48fc24f2ecf779a7f3f345e02df9807ed6d4820c59caee",
    "signature_base64": "vAnY0JaxPcwON5O01EXbMcEm/tzI+jJrWRIb5PPUUOv0dCsKUwKls1C9Zu70DJPO4d/7UBXs/xV+uptJUuUDAQ=="
  }
}
